title,text,url,date
Built a Simple Supplement Reminder iOS App,"Hey everyone,

(Mods, if this post isn’t allowed, feel free to remove it.)

I take supplements regularly, but I kept running into the same problems:
- Forgetting to take them
- Tracking my intake progress

I wanted a simple, clean app that just helps with reminders and tracking—nothing bloated, no giant database of supplements—just an easy way to stay consistent. So I built Suppl

It’s designed the UI to be minimal and straightforward:
- Set reminders for each supplement
- Log doses quickly
- Nice UI to view history
- Gamify progress with streaks 

I’d love to hear from others who take supplements:
- What features would make this more useful for you?
- Any frustrations with existing tracking apps?

The goal is to make something genuinely helpful for the community, so any feedback is super appreciated!

Here is the link to the app: https://apps.apple.com/app/id6743336030",https://www.reddit.com/r/Supplements/comments/1jjo9t7/built_a_simple_supplement_reminder_ios_app/,1742922032.0
Nestle owned supplement brands,"There’s a current boycott of everything Nestle. You might not be aware that Nestle owns several popular supplement brands including Pure, Nature’s Bounty, Solgar, Puritan’s Pride. Here is their full list.

https://www.nestlehealthscience.com/brands",https://www.reddit.com/r/Supplements/comments/1jjns9s/nestle_owned_supplement_brands/,1742920840.0
"Looking for a non-gummy, chewable, methylated multivitamin","I think the one I had been buying has been discontinued. 😭

I'm looking for a chewable multivitamin for a family member with autism that has difficulty swallowing pills and has sensory issues with gummy candies. It needs to have methylated folate because he has an MTHFR mutation.

Any suggestions would be greatly appreciated!",https://www.reddit.com/r/Supplements/comments/1jjnnml/looking_for_a_nongummy_chewable_methylated/,1742920517.0
Best Adaptogen and Nootropic Combos?,"Hey everyone, I’ve been taking L-theanine for about a month after hearing great things about its benefits, but I recently stopped because I felt like my brain fog got significantly worse while using it. I struggle with ADHD symptoms, brain fog, and general anxiety, so I was hoping it would help.
I’ve read online that adaptogens are often more effective when taken in combinations because they can balance each other out—for example, pairing ashwagandha with rhodiola to counteract the numbing effects of ashwagandha.
What do you think is the best mix of adaptogens and nootropics for managing ADHD, brain fog, and anxiety? Any personal experiences or recommendations would be super helpful!",https://www.reddit.com/r/Supplements/comments/1jjn8jw/best_adaptogen_and_nootropic_combos/,1742919457.0
Is it ok to take these supplements all at the same time each day?,"Hi all, ive recently been trying to improve my health and turn my life around as I have neglected myself for quite some time now and am feeling the effects of it such as trouble sleeping, fatigue, muscle and bone pain, random sharp pains, headaches and other more complex stuff. Went to the doctor a while ago and had some blood tests and found that I was severely deficient in vitamin D and that was about 6 months ago and I have been having vitamin D tablets ever since.

What I am currently taking now is Mulitvits&Iron , Tumeric, Apple Cider Vinegar, Vitamin D, Cod Liver Oil and occasionally evening primrose oil when and around my period as I read somewhere that the long term effects of primrose oil is unknown, so they are fine for short use, which in my head I believe to be for about 1 week of use per month??? 

Is this combination of supplements okay? I take them when I have my dinner but was just wondering if all of these were fine to have all at the same time.

Thanks",https://www.reddit.com/r/Supplements/comments/1jjn85l/is_it_ok_to_take_these_supplements_all_at_the/,1742919430.0
I love Taurine but its bad for my libido,"
I started using taurine about a week ago and I really like it. It has helped my anxiety better than any antidepressants, but I've started to notice that my libido has decreased significantly. Does anyone have any advice on what I could take with taurine to counteract this effect?
",https://www.reddit.com/r/Supplements/comments/1jjn60h/i_love_taurine_but_its_bad_for_my_libido/,1742919287.0
Best Biotin Bramd,Can anyone please help me to find best Biotin Brand for hair in Canada ? ,https://www.reddit.com/r/Supplements/comments/1jjmzqm/best_biotin_bramd/,1742918852.0
L-Citrulline-Malate 9-15g daily,"Can you take it daily without any concern?

I don‘t lift, but could notice a positive effect on my endurance (football), mood and energy in general.

Does anyone use it daily at higher dosages?",https://www.reddit.com/r/Supplements/comments/1jjmh24/lcitrullinemalate_915g_daily/,1742917555.0
Absorption studies that prove more absorption is more effective,"I recently read Super Gut by William Davis.  In this book he floats a theory, ingredients difficult to absorb are effective because of the interaction with the gut (ie Turmeric) not the amount that gets into the blood stream.   I have seen many studies on how some of these ingredients are poorly absorbed and how to increase absorption.  But I have yet to see a study that more absorption produces better results. ",https://www.reddit.com/r/Supplements/comments/1jjmg9x/absorption_studies_that_prove_more_absorption_is/,1742917501.0
"Berberine, dose and time of day?","Im planning to take Berberine as a form to help with type 2 and weightloss I currently am not taking medications and only take multivitamins and pre/probiotic. 

There is alot of information saying to take in morning and alot saying in evening. And alot of those are older posts. 

Just wanting to know from experience which worked the best for people? And what dose seemed the best balance? 1500 was the most common I said suggested.

Thanks in advance",https://www.reddit.com/r/Supplements/comments/1jjlult/berberine_dose_and_time_of_day/,1742916012.0
Best Glucosamine Chondroitin Brand? Recommendations please.,"I’ve been using Kirkland's for a while to help with some knee pain from running, but it hasn’t really done much for me. 

I’ve heard mixed things about it, and I’m ready to try something that actually helps with joint support and recovery. 

Is it the brand that's the issue? 

Or do all brands offer similar products?

I’ve been eyeing Move Free and Doctor’s Best since they seem to get good reviews, but I wanted to see if anyone here has experience with them or can suggest something else.

If you’re someone who’s dealt with joint discomfort, what have you found works best? 

Appreciate the help!",https://www.reddit.com/r/Supplements/comments/1jjled3/best_glucosamine_chondroitin_brand/,1742914860.0
How to safely increase glutathione with amalgam fillings,"As the title says, how can I do so?",https://www.reddit.com/r/Supplements/comments/1jjlbg6/how_to_safely_increase_glutathione_with_amalgam/,1742914651.0
Nutricost 100mg Niacin no flush feeling?,"Title + I was expecting a larger experience in terms of the flush from what I read online but maybe im just not that sensitive? 

Any insights? 

From what I understand its a good brand and I confirmed it was Nicotinic Acid so It would have the flush. 

Thanks",https://www.reddit.com/r/Supplements/comments/1jjlb0d/nutricost_100mg_niacin_no_flush_feeling/,1742914617.0
Do you trust nutrition or supplement advice from LLMs and apps?,"I haven't talked to a real nutritionist in like 5 years because honestly, I can just ask GPT or an app to tell me what I need. And it's been working out for me, both for diet advice and supplements, and the only real people I talked to are the gym guys.

I do read a lot of stuff on forums, but I usually just ask GPT what foods to eat for like energy or gut health or anything else I need. It's convenient and actually helpful, and it's free. I've also been using this [Menalam](https://apps.apple.com/us/app/menalam/id6741103231) app for supplements, and for example, it told me I was low on magnesium and omega-3s, and after I started taking them, my sleep and focus got way better, and I didn't need to talk to anyone else.

So now I'm thinking - is this the new normal? Are most people just skipping over experts and doctors and just talking to AI for health advice? Or is it just nutrition and not more ""important"" things? Really curious what everyone else is doing and how it's working for you.",https://www.reddit.com/r/Supplements/comments/1jjl8zi/do_you_trust_nutrition_or_supplement_advice_from/,1742914461.0
"L theanine ""withdrawals""","I took between 100mg-200mg of L Theanine a day for about 10 days - primarily for relaxation and also due to its supposed hepatoprotective properties. I stopped taking it altogether this past Saturday and since then have had 3 nights of terribly restless sleep. Is this something anyone else has experienced? If so, how long before you got back to normal? TIA",https://www.reddit.com/r/Supplements/comments/1jjkz8v/l_theanine_withdrawals/,1742913749.0
Amazon Elements,"Thoughts on Amazon’s line of supplements? Everything they claim sounds good, and the price is great obviously. Does anyone have any experience with these or any additional information about quality? ",https://www.reddit.com/gallery/1jjkxyx,1742913655.0
ZMA .. What brand to choose?,"I am looking to get ZMA and can’t decide what brand to go with. I checked the companies recommended mostly (Pure Encapsulations, Thorne, Jarrow, and Life Extension, Nootropics) don’t have a ZMA formulation.

What do u guys take and recommend to get started on ZMA?",https://www.reddit.com/r/Supplements/comments/1jjkwsm/zma_what_brand_to_choose/,1742913569.0
Life extension brand?,"I recently started buying Life Extension on the recommendation of a buddy who’s usually well researched. He mentioned high quality and they stick with the formulations without adding hidden or unknown ingredients. 

Thus far I’ve been happy with their speed of shipping but I’ve also noticed a high number of capsules broken open inside their bottles.  With other brands, KAL or Natures Bounty, for example I’ve never had this issue. 

They also spam the absolute hell out of me via text.  I’ll order something, then three days later they want me to order the same thing at 40% off.  This is a massive turnoff. Just give me the sale price when I order or make your products cheaper to begin with?

I use them primarily for MagTein, CoQ10, Taurine, L Argenine.  

If anyone has info as to quality of their product I’d appreciate it or if I should be looking elsewhere before I place my next order. ",https://www.reddit.com/r/Supplements/comments/1jjkm85/life_extension_brand/,1742912785.0
I think i have very low dopamine. Help?,"Mid December i decided to quit weed, a week later i decided to quit alcohol and caffeine too. Shortly after i noticed some unpleasant things. At first i thought they were just withdrawal symptoms, and i believed that was the entire issue, but now that it has stabilised and i feel 0 cravings, i am starting to suspect there might be more to it.

My therapist has brought up the possibility of me having ADHD and suggested to pursue further testing.

What i noticed since quitting:

* ⁠Lots of anxiety/panic attacks 
* ⁠Absolutely no motivation to keep up hobbies i had
* Zero motivation at work 
* ⁠Fatigue, apathy, tiredness 
* Lower (almost no) libido 
* ⁠Lost interest in socialising

All of this is very unusual for me. Sure, i’ve always had bad days, sometimes i’d be anxious or be a bit sad. But ever since quitting i feel much worse mentally. I used to go out on the weekends, take long car trips just because i wanted to take some photos, i loved going out to restaurants even if alone. But now i just don’t feel the need to do any of that. I go to work, go to the gym, rot at home, go to bed. And repeat. I even lost any desire to play videogames, which is something i liked to do from time to time. 

This is extremely unusual for me, and i am looking on ways to “boost” my dopamine or at least bring it up a bit, because i feel like i’m just existing through the days waiting for motivation to come back.

Known deficiencies: 

* ⁠low Vitamin D: 14 ng/mL (ref range 30 - 100) •	⁠low folates: 2.20 ng/ml (ref range >4.60)

Supplements:

* ⁠Vitamin D (4000 IU/day); Folic acid 5mg/day, High dose vit B complex (B1, B6, B12), Mag glycinate.

Edit to add: I quit in order to become healthier, not because i had problems regulating myself. I'd smoke weed in the evening before bed (3/4 puffs) and on sunday morning (a bit more). As for alcohol, i was drinking to the point of being drunk once per month, tipsy twice per month. With the occasional beer here and there.

As for coffee, i never went over two small espresso cups (30 ml) of coffe, so only abput 100mg of caffeine at most. i do not believe i am suffering withdrawals, i believe i am struggling with the absence of dopamine.

This is my attempt at living completely sober, and it's not going great.

Edit2: i exercise, i go to the gym and do cardio. I eat well and have lost 40lbs since November, so at least i know it’s not food induced",https://www.reddit.com/r/Supplements/comments/1jjkegs/i_think_i_have_very_low_dopamine_help/,1742912212.0
Has anyone used St John’s wort (johannis kraut ) for depression?,I have just been prescribed St John’s wort for my depression. I will be taking 900mg daily. I would love to know if it has worked for anyone else and what I should watch out for . I hope to hear some success stories as I would love to stay on a natural path🤍,https://www.reddit.com/r/Supplements/comments/1jjk4ia/has_anyone_used_st_johns_wort_johannis_kraut_for/,1742911486.0
Are there benefits to taking Fish oil if you already get sufficient omega 3 from your diet?,Are there benefits to taking Fish oil if you already get sufficient omega 3 from your diet?,https://www.reddit.com/r/Supplements/comments/1jjjx5t/are_there_benefits_to_taking_fish_oil_if_you/,1742910940.0
Preworkout on non traing days,"Hi everyone! I am not doing weightlifting but I do boxing and running as of current but mostly boxing (pads work, sparring, drills … etc ) 5 or 6 days (sometimes less). I just started creating my own pre workout drink as I was used to not take any pre workout supplements but has a change of thought lately. 

My own pre workout includes:

Creatine 10 g
Beta alanine 5 gm
TMG (Betaine anhyd) 4 gm
L-Citruline 12 gm
Malic acid (pure) 3 gm
L carntine 5 gm

I take the above before training on training days as well as non-training days. I am not sure if what I am doing isnecessary or not. I read that only creatine and beta alanine need to be taken daily but the others no. Is this correct? What are your experiences?",https://www.reddit.com/r/Supplements/comments/1jjj4g3/preworkout_on_non_traing_days/,1742908628.0
Is this good vitamin d3 supplement,"Is aavalabs vitamin d3 good ?? Are there better brands ? 


https://aavalabs.com/products/vitamin-d3-k2?_pos=1&_sid=ef3f0eced&_ss=r",https://www.reddit.com/r/Supplements/comments/1jjj3um/is_this_good_vitamin_d3_supplement/,1742908579.0
Preworkout on non-training days,"Hi everyone! I am not doing weightlifting but I do boxing and running as of current but mostly boxing (pads work, sparring, drills … etc ) 5 or 6 days (sometimes less). I just started creating my own pre workout drink as I was used to not take any pre workout supplements but has a change of thought lately. 

My own pre workout includes:

Creatine 10 g
Beta alanine 5 gm
TMG (Betaine anhyd) 4 gm
L-Citruline 12 gm
Malic acid (pure) 3 gm
L carntine 5 gm

I take the above before training on training days as well as non-training days. I am not sure if what I am doing isnecessary or not. I read that only creatine and beta alanine need to be taken daily but the others no. Is this correct? What are your experiences?",https://www.reddit.com/r/Supplements/comments/1jjj3e5/preworkout_on_nontraining_days/,1742908537.0
Help vitamin d deficiency,Hi I have a vitamin d3 deficiency does someone know high quality brand of vitamin d3 + k2 ? Thanks ,https://www.reddit.com/r/Supplements/comments/1jjivgu/help_vitamin_d_deficiency/,1742907878.0
pyridoxine HCL safe dose?,"hey guys, recently got L-Tyrosine from Vitamin Shoppe not realizing it 10 vitamin b6 as pryidoxine HCL per capsule (which is annoying, idk why all their amino acid products have this). I've found 1.5-2g L tyrosine works best for me, but I'm concerned about taking too much b6. I usually take L tyrosine about a month or two at a time then take a break, how much b6 can I consume per day as a 200lb man while still being safe? I've heard it can have toxicity at higher doses",https://www.reddit.com/r/Supplements/comments/1jjih6v/pyridoxine_hcl_safe_dose/,1742906687.0
"I'm confused about omega suppliment. There is two of them, which one is better and what's best time to take them?",,https://www.reddit.com/gallery/1jji93e,1742905987.0
"Sports supplement creatine makes no difference to muscle gains, trial finds",,https://www.unsw.edu.au/newsroom/news/2025/03/sports-supplement-creatine-makes-no-difference-to-muscle-gains-trial-finds,1742904920.0
Best supplement for female hair loss?,"I builders a stack for my girlfriend that suffer from hair thinning and loss, probably related to the mild PCOS that she has. 
I tried to build this stack for her: what do you think about?


Upon waking → Zinc Picolinate (22 mg)

30 min after waking → Myo-Inositol + D-Chiro-Inositol (4 g)

After breakfast (e.g., 8:00 AM) → Saw Palmetto (320 mg)

At lunch (4+ hours after zinc) → Copper Bisglycinate (2 mg)

With lunch → Vitamin D3 + K2 (100 mcg D3 + 150 mcg K2)

With dinner → Omega-3 (EPA/DHA) (1600 mg)


",https://www.reddit.com/r/Supplements/comments/1jjho3y/best_supplement_for_female_hair_loss/,1742904042.0
Rate my daily stack and what can I do to improve it?,Male 42,https://i.redd.it/83c5ku0vgtqe1.jpeg,1742900134.0
Rate my daily stack and what can I do to improve it?,Male 42,https://i.redd.it/83c5ku0vgtqe1.jpeg,1742900133.0
Any supplements worth taking for athletic performance?,"Hi guys hope everyone is well.

I wanted to ask if there are any intermediate / advanced athletes who take supplements that have noticed an increase in athletic performance in the gym? 

If yes, could you be so kindly to let me know what supplements you take and what kind of benefits you have noticed from taking them. ",https://www.reddit.com/r/Supplements/comments/1jjg6m3/any_supplements_worth_taking_for_athletic/,1742898347.0
Is My Gold Standard Whey Vanilla Ice Cream Legit? Need Your Thoughts!,"I just bought Gold Standard Whey (Vanilla Ice Cream flavor) from a local store, and since I’m new to this brand, I’m a little unsure about it. The seal was intact, no glue marks or anything weird, and it mixes well with cool water but doesn’t mix with boiling water. I’ve already had it twice with no issues.

I’ve attached some images on Imgur for reference ([link here](https://imgur.com/a/Z7lr0Bc)). For anyone who’s tried this product before, does everything look and sound normal? How’s the Vanilla Ice Cream flavor supposed to taste? Just want to make sure I got the real deal. Would really appreciate any feedback!

**For images click on this link**  [https://imgur.com/a/Z7lr0Bc](https://imgur.com/a/Z7lr0Bc)",https://www.reddit.com/r/Supplements/comments/1jjg48e/is_my_gold_standard_whey_vanilla_ice_cream_legit/,1742898076.0
Looking for joint supplements without added vitamins,"I turn 30 this year and I’ve noticed more aches and pains the last few years so decided to look into joint supplements to help take care of my body. But my issue is all the ones I’ve looked at have other added vitamins like D, B and C ect, but I already take a multivitamin and other stuff for those. 

So I’m trying to find some joint supplements that have the things I want like glucosamine and chondroitin ect without the vitamins, any recommendations? ",https://www.reddit.com/r/Supplements/comments/1jjfs64/looking_for_joint_supplements_without_added/,1742896716.0
Which supplements do you rotate?,I'm looking for ideas. I don't want to overuse or build a tolerance to any supplements.,https://www.reddit.com/r/Supplements/comments/1jjfnoi/which_supplements_do_you_rotate/,1742896146.0
Which is the better Vitamin D3 + K2 Supplement?,"I’m looking for a 5,000 IU D3 supplement as I’m deficient in Vitamin D (actually below deficient levels). My doctor prescribed a 50,000 IU supplement once per week for 12 weeks. I’m scared to take such a high dose at once, especially after reading contradictory experiences. So, I decided to take 5,000 IU per day (doctor approved). Which is the better supplement - Now or Solaray? I’ve never seen “MK-7” before and there’s a notable difference in K2 levels - which is better overall?",https://www.reddit.com/gallery/1jjfm9b,1742895961.0
Antioxidants - your body is rusting like metals,"I hear here and there that this supplement have Antioxidant effect etc, but I always wonder how can we see the effect. Then I asked AI to ELI5 and I like the words that came our, your body is rusting, here

>Imagine your body is like a metal car. Over time, rust (called ""oxidative damage"" in your body) starts to form from things like pollution, sunlight, and even just using the car.

>Antioxidants are like a special wax or protective coating that slows down or stops the rust from forming. They do this by neutralizing the ""rust-causing"" things, which are called ""free radicals.""

>So, antioxidants help protect your body's cells from damage, keeping them healthier for longer!

Again I asked ELI5 what are free radicals

>Imagine tiny, bouncy, angry balls inside your body. These balls are called ""free radicals.""

>**Angry and Unstable:** They're ""angry"" because they're missing a tiny piece (an electron) and they want to steal it from something else.

>**Damage Causing:** When they steal that piece, they damage the thing they stole from, like your cells or DNA.

>**Chain Reaction:** Then, the thing they stole from becomes an angry ball too, and it steals from something else, starting a chain reaction of damage.

>**From Everyday Life:** These angry balls come from things like:

>Pollution, Sunlight, Smoking, Even just your body using energy

>So, free radicals are like tiny troublemakers inside you, and antioxidants are like little peacekeepers that calm them down.

What Antioxidant supplements are you using? How do you recognize the effects? ",https://www.reddit.com/r/Supplements/comments/1jjf8qp/antioxidants_your_body_is_rusting_like_metals/,1742894225.0
Chronically sore & tight since stopping with ZMA,"
I’ve been taking ZMA for 3 months daily to help with recovery from gym workouts. Finished the pack a few weeks ago and thought of trying to see how’s my performance is without it. To my surprise some muscles are now chronically tight, fatigued, and aching. Specifically the hamstrings, forearms, biceps, and shoulders/scapula.

The hamstrings are so sore & tight even 3-5 days after working them. I feel that if I try to stretch them I might even tear them or injure myself.

Can it be related to stopping with ZMA?
",https://www.reddit.com/r/Supplements/comments/1jje4d1/chronically_sore_tight_since_stopping_with_zma/,1742888926.0
Magnesium Citrate,"Generally used as a laxative, but I am really curious as to where the upper limit of this lies. 

Couldn't find any threads wherein they spoke of it. 
I took 800MG with little issue. Can someone please temme what their experience was? ",https://www.reddit.com/r/Supplements/comments/1jjc2tf/magnesium_citrate/,1742879865.0
Glycine and Cancer Relationship,"If you Google ""glycine and cancer"" or ask ChatGPT about the topic, there's some potentially worrisome results. I'm particularly worried about brain cancer, and this study talking about glioma formation.  

https://journals.biologists.com/jcs/article/127/17/3687/54547/Intracellular-glycine-receptor-function

This study doesn't specially link dietary or supplemental glycine to cancer, and I don't think any other study has either. But do you think glycine should be avoided just in case?

~~ EDIT ~~
Thanks for the input everyone. I've started a discussion on /r/Biohackers too, as suggested:

https://www.reddit.com/r/Biohackers/comments/1jjnxpo/glycine_and_cancer_relationship",https://www.reddit.com/r/Supplements/comments/1jjbzwb/glycine_and_cancer_relationship/,1742879543.0
Magnesium and Serotonin,"I haven’t been able to find much conclusive info on how exactly magnesium affects serotonin other than that it increases your serotonin levels in your body. Is it possible that this increase could keep me awake or have other adverse effects if I’m on a medication such as an SSRI or SNRI? From my experience with magnesium glycinate I can’t tell if it noticeably decreases my anxiety, and I don’t think it is making my sleep any better.",https://www.reddit.com/r/Supplements/comments/1jjbtla/magnesium_and_serotonin/,1742878859.0
NAC &Serrapeptase,I read many research articles that say Nac and serrapeptase are helpful for endometriosis. I want to incorporate these 2 supplements to for scar tissues and adhesions caused by multiple surgeries and endometriosis. However they gave me bad stomach pain due to my gastritis. Does anyone know there are alternative supplements that help break down scar tissue &adhesions that doesnt irrirate stomach lining and gentle on stomach? Thanks ,https://www.reddit.com/r/Supplements/comments/1jjahee/nac_serrapeptase/,1742874087.0
