title,text,url,date
calming magnesium that doesn’t induce depression,"Are there any calming forms of magnesium to help you relax other than glycinate, which makes me and several others on this sub depressed for some reason.",https://www.reddit.com/r/Supplements/comments/1jgarbc/calming_magnesium_that_doesnt_induce_depression/,1742539679.0
Is this ok?,Is it ok to put 1 drop of oregano oil into a glass of orange juice and then drink it?,https://i.redd.it/p7uprhwmjzpe1.jpeg,1742537848.0
Discover the power of 100% natural Premium Moringa Capsules,"# The Miracle Tree

Moringa Oleifera is a plant extract primarily from the leaves of the moringa tree. These precious leaves contain dozens of vitamins, minerals, and other phytonutrients, which is why moringa is offered referred to as the “The Miracle Tree.”  
  


In fact, moringa oleifera contains 25 essential vitamins & minerals, 47 active antioxidants, 36 known anti-inflammatory agents, and all 8 essential amino acids. It’s known to help with dozens of health ailments, making it one of the most versatile plant extracts in alternative medicine.  
  


Moringa oleifera’s most widely known benefit is that it provides the body with over 92 nutrients, including 46 anti-oxidant compounds and all eight essential amino acids.",https://moringacapsules.store/buy-pure-moringa,1742536347.0
Is Nattokinase legitimate or snake oil?,Nattokinase is very expensive and makes a lot of claims. I'm trying to help break up clots in my blood from years of a terrible diet filled with processed food 24 hours a day. Is it cheaper to just learn how to ferment soy beans? Looking forward to your experiences with this supplement.,https://www.reddit.com/r/Supplements/comments/1jg9xvh/is_nattokinase_legitimate_or_snake_oil/,1742536173.0
Supplement Recommendations for 30-year old female,I am a healthy 30 year old female. I workout 3/4x per week and each mostly Whole Foods. What supplements should I take daily and weekly to feel as good as possible? ,https://www.reddit.com/r/Supplements/comments/1jg9jfn/supplement_recommendations_for_30year_old_female/,1742534502.0
"“The benefits of creatine may have been overestimated in the past, due to methodological problems with previous studies” - Dr Hagstrom",Have I been giving myself the squirts for no reason? 😫,https://www.unsw.edu.au/newsroom/news/2025/03/sports-supplement-creatine-makes-no-difference-to-muscle-gains-trial-finds,1742534318.0
Appetite Increasing Supplement,"(M,30) on hydroxychloroquine 200mg for an autoimmune disease. One of the side effects is loss of appetite. Any recommendations for supplements to increase appetite? I miss being able to eat 3 times a day. I barely eat one now. ",https://www.reddit.com/r/Supplements/comments/1jg999o/appetite_increasing_supplement/,1742533391.0
US Based Customizable Pre-Workout Formula Companies,"I want a pre-workout that I can customize to my needs and preferences, but I don't need to go out and buy all of the raw ingredients and mix it. Does anyone know of a US based company that does something similar to this for a reasonable price? I know of One-Lab, but they're based in Australia and the pre comes out to $120 with shipping and that's just too much for me. preferably something where I could freely customize the dosages. Thanks!",https://www.reddit.com/r/Supplements/comments/1jg5h9g/us_based_customizable_preworkout_formula_companies/,1742520761.0
Has anyone experienced headaches as a side effect of magnesium glycinate?,"I recently started taking magnesium glycinate and have noticed that I’ve been experiencing headaches. I’m a bit concerned, but I’m trying to stay positive and hope that it’s just a temporary side effect that I’ll get used to, like with many supplements or medications.

I would love to hear if anyone here has experienced the same thing when first starting magnesium glycinate? If you’ve had headaches or similar symptoms in the beginning, how long did they last for you? And most importantly – did the side effects go away as you got used to the supplement over time?",https://www.reddit.com/r/Supplements/comments/1jg4ffh/has_anyone_experienced_headaches_as_a_side_effect/,1742517545.0
Whats the best supplement that’ll raise iron levels,Ive been anemic for 15 years and recently started having low blood pressure and hemoglobin. Ive tried Thorne iron ferrasorb with vitamin c and beef liver. Have not noticed a significant difference since i started 8 months ago. What worked best in your experience? ,https://www.reddit.com/r/Supplements/comments/1jg4eoq/whats_the_best_supplement_thatll_raise_iron_levels/,1742517480.0
Junkless Nutrition,"Just ordered 500 caps of 3% Tongkat Ali for $24 on Ebay. Appears all their supps are low price, just wondering if anybody had any experience with the company Junkless, did some Google searches but not much came up.  Thanks",https://www.reddit.com/r/Supplements/comments/1jg3yhz/junkless_nutrition/,1742516130.0
What's the best sea moss gummy?,"I have two parts to my question. 

What are the benefits of sea moss gummies? Why should I take them? Which one is the best one to buy? ",https://www.reddit.com/r/Supplements/comments/1jg3r06/whats_the_best_sea_moss_gummy/,1742515540.0
"Vitacost, wth?","I've been using vitacost for many years successfully but, man, this last order was horrible. Three of the seven bottles I ordered were not in the package but the order showed fully delivered in their system. Almost half of the monetary value of the order was missing. I probably do 150 mail orders a year and this is the most butchered order I've experienced in 5 years. It's hard for me to believe it's not on purpose that they short the order, but i guess it could just be a stoner order person.",https://www.reddit.com/r/Supplements/comments/1jg2zox/vitacost_wth/,1742513449.0
Muscle growth combo,"I'm 50 years old and was diagnosed severe anemic at the end of 2022 which ended up causing muscle atrophy. I ended up losing over 20+ pounds of muscle because of it. I spent the entire year of 2023 in and out of hematologist, gastroenterologists, etc. 

After a year of them poking me to figure out where the anemia was coming from my iron returned to normal at the end of 2023. During the entirety of 2023 i wasnt allowed to go to the gym. No cause was ever found for my anemia, although internal bleeding was suspected. 

I had 2 months of physical therapy at the beginning of 2024 and then was finally allowed to go to the gym on my own in March 2024. Ever since then I've been loading on protein daily in the form of shakes, eggs, meat etc. I added creatine to the mix in August 2024. 

Gains have been glacial to say the least. My physician hasn't had much information to give in the way of what to take in addition to creatine in my shakes. I'm starting to get frustrated with the lack of gains and was wanting to try some vitamin supplements to hopefully see more results. 

Any assistance on what particular vitamins would be super helpful and hopefully help me on my way back to normal. ",https://www.reddit.com/r/Supplements/comments/1jg19y1/muscle_growth_combo/,1742508891.0
What makes people choose supplements over scientifically-proven cancer treatment?,"As that does cancer research, most of us do it bc our families have been destroyed by cancer. 

We get paid poverty wages. We do it because we care. We are not hiding anything. 

What makes you trust random influencers online more than scientists? ",https://www.reddit.com/r/Supplements/comments/1jg185n/what_makes_people_choose_supplements_over/,1742508762.0
Vitamin B6 High,"Any recommendations on getting this value down? For the last three months, I have been experiencing muscle soreness, peripheral neuropathy, muscle twitching, etc. I saw a neurologist and he couldn't figure out what was going on, but said to get my vitamin levels checked. 

Well, this is what I'm working with. Any advice? ",https://i.redd.it/dex5kl2n3xpe1.png,1742508244.0
What is the definitive answer on Creatine's effect on kidneys?,"Creatine was responsible for [lifting my depression](https://www.reddit.com/r/Supplements/comments/1ix2qyd/lifted_depression_with_fishkrill_oil_creatine/) for 10 days, however, after reading about its possible effect on the kidneys, I stopped taking it. I've scoured dozens of posts with some saying it's fine to take, just drink enough water. I've come across other posts where kidney doctors tell their patient to never take creatine ever. So which is it, safe on the kidneys or a danger to them? I really WANT to take creatine again so I'm hoping it is safe on the kidneys.",https://www.reddit.com/r/Supplements/comments/1jg0j18/what_is_the_definitive_answer_on_creatines_effect/,1742506996.0
"5 weeks on Creatine – Amazing performance, but bloated and gaining weight! Help?","Hi everyone,

I've been taking creatine monohydrate consistently for exactly 5 weeks now. 5g a day without a loading phase. Of all the supplements I've tried (and I've tried quite a few!), creatine is the first one where I genuinely feel a noticeable difference. I play racket sports very intensely and run regularly, and since starting creatine, my endurance has improved dramatically, and even better my recovery feels amazing.

But... there's always a but...

I'm naturally well-built but already on the heavier side. In these 5 weeks, my weight has been fluctuating quite noticeably—going up and down by as much as 3.5 kg (about 7-8 lbs)—and I feel bloated with a visible ""beer belly"" look.

I really don't want to stop taking creatine because of how beneficial it's been for my workouts, but the bloating and weight gain really bother me.

I am sure I am not the first one to feel like this... Will it go away on its own? Any tips or advice would be greatly appreciated!

Thanks in advance!",https://www.reddit.com/r/Supplements/comments/1jg0fgy/5_weeks_on_creatine_amazing_performance_but/,1742506746.0
Life Extension Super Omega-3 EPA/DHA Fish Oil Sesame Lignans & Olive Extract,"I bought a bottle of 120 of the above supplement and stored it in the fridge, however, the softgels have gone rancid within 60 days….Not sure what else I could’ve done to avoid oxidation, do you guys?",https://www.reddit.com/r/Supplements/comments/1jfzw7n/life_extension_super_omega3_epadha_fish_oil/,1742505374.0
Should I risk taking Biotin?,"According to many things I have read Biotin would be a good supplement for me, I have a concern over being allergic to it though. My mother learned the hard way she is pretty seriously allergic to it and I don't know if I should risk taking it. 

Does anyone know if a Biotin allergy can be genetically passed down?",https://www.reddit.com/r/Supplements/comments/1jfzmc5/should_i_risk_taking_biotin/,1742504683.0
Thoughts on Dicalcium Phosphate,"I've generally try to avoid day calcium phosphate in supplements. But I'm looking at getting either the Thorne Basics 2/day, or Thorne Elite. Both of these have Dicalcium Phosphate in. Giving Thorne supposed to be one of the best brands, I'm questioning if Dicalciumphosphate is actually thatvbad and to be avoided or not. Im just wondering if anyone has any thoughts on this, or any links to useful info/articles. Thanks",https://www.reddit.com/r/Supplements/comments/1jfyoa1/thoughts_on_dicalcium_phosphate/,1742502344.0
What builds strong fingernails?,"I recently went through a period where I was eating a lot of cashews daily. My fingernails got super thick and strong. I asked ChatGPT what might be responsible for this and it suggested high Biotin content in cashews. 

When I stopped eating cashews, I decided to take Biotin as a supplement thinking that might be responsible, but my fingernails went back to normal. Was it just all the protein I was consuming that made my nails strong and thick or is there something else at play?",https://www.reddit.com/r/Supplements/comments/1jfykx5/what_builds_strong_fingernails/,1742502114.0
Why won’t Thorne share their heavy metal tests?,I thought the company had a great reputation and I have been using their berberine. When I emailed asking for the tests/CoA they gave me a long answer that basically said we won’t share it with you but you can totally trust us. I don’t understand why it is so hard to share this testing for a concerned customer especially when they charge so much for their products.,https://www.reddit.com/r/Supplements/comments/1jfyd9m/why_wont_thorne_share_their_heavy_metal_tests/,1742501597.0
Stack feedback,,https://www.reddit.com/gallery/1jfxj5w,1742499540.0
Capsule shaker table / alignment,"I have a 10x10 capsule tray, and by hand feed in the tops and bottoms.

Is there any tool out there for a 'shaker' like tray where the halves will self align to the holes, and I can just push them in? Or should I design something ?",https://www.reddit.com/r/Supplements/comments/1jfxbn8/capsule_shaker_table_alignment/,1742499015.0
How much ?,How much Vitamin C to take for a stimulant comedown? ,https://www.reddit.com/r/Supplements/comments/1jfxbl0/how_much/,1742499011.0
"If you drink at night, 2-3 drinks, safe to take NAC in the morning?",Is it bad for your liver? I mean by that time all the alcohol is out of your system,https://www.reddit.com/r/Supplements/comments/1jfx4k7/if_you_drink_at_night_23_drinks_safe_to_take_nac/,1742498526.0
Sodium supplements,"Looking for recommendations on a good product / brand available in Canada ideal for elderly person having Hyponatremia.

Is Organika / Biosteel / Vega electrolyte any good?

",https://www.reddit.com/r/Supplements/comments/1jfvhd8/sodium_supplements/,1742494450.0
"If I have a blood test, how many days prior should I stop supplementing so as to not distort results?","Pretty much what the title says. I've been supplementing for ca. 6 months and want to know, where I'm at.

I'm taking stuff like Magnesium, Omega3, Vitamin D3, etc. I know, I should not eat ca. 13h before the test, but what about the supplements? Can you take, say, Omega3 right until the day before? I don't want to have false high values, if that makes any sense. TIA!",https://www.reddit.com/r/Supplements/comments/1jfugsa/if_i_have_a_blood_test_how_many_days_prior_should/,1742491959.0
NAD + shot cleared up my acne!,"I got a shot of NAD + for other reasons, but within a few days it completely cleared up the skin on my face. I was eating worse than usual this week, and I'm at the point in my menstrual cycle where my acne should be really bad. Has anyone else experienced it? I suspect it's due to reduced inflammation.",https://www.reddit.com/r/Supplements/comments/1jftqcb/nad_shot_cleared_up_my_acne/,1742490145.0
Quercetin - Here we go again.,"I have mild Hyperthyroidism (too much thyroid).  I was suggested to take Quercetin for Interstitial Cystitis (painful bladder syndrome).  It is theorized that IC is made worse from too much histamine.

I started reading about Q and it was said it interfered with Thyroid.  And I started wondering 'why?'.  What exactly is it about Q that messed with the thyroid?

I was then reading that a lot of Q supplements use kelp powder or seaweed as filler.  I know that both of those things are problems for thyroid.

My question is if I took a vegetarian capsule with no kelp/seaweed/fish, would that fix the issue and not affect the thyroid?",https://www.reddit.com/r/Supplements/comments/1jftcdt/quercetin_here_we_go_again/,1742489167.0
Need some information regarding 'Alphadrol',"I'm not a 100% sure what this is, but a guy in my gym showed me these pills called 'Alphadrol' which he said were not a steroid and more like a 'enhanced creatine'. I couldn't find anything about it on the internet. Thought I'd ask you guys here if anyone knows about this or have taken it. Would love to know your opinions! ",https://www.reddit.com/r/Supplements/comments/1jfszx7/need_some_information_regarding_alphadrol/,1742488286.0
Calcium supplementation,Does anyone else supplement with calcium? My calcium is a bit below normal even though i eat a bowl of greek yogurt every single day. ,https://www.reddit.com/r/Supplements/comments/1jfsivs/calcium_supplementation/,1742487094.0
Magnesium Glycinate dosage?,"I've got GERD and anxiety, and am starting on Magnesium Glycinate since I'm PPI resistant. Information online I'd rather unclear when distinguishing between actual magnesium and magnesium glycinate... 

I have 400mg (m glycinate) / 60mg (magnesium) capsules from DoubleWood. How much should I be taking?",https://www.reddit.com/r/Supplements/comments/1jfs91h/magnesium_glycinate_dosage/,1742486412.0
Anyone Tried This Agmatine?,,https://i.redd.it/yik7rj76avpe1.jpeg,1742486226.0
Is Citrulline malate & Beta alanine worth taking?,"Thinking about swapping out ABE pre workouts for Citrulline malate & Beta alanine due to trying to reduce the amount of caffeine im intaking from pre workouts. Is it really worth taking? Also if it is, Is it recommended to take on a daily basis?",https://www.reddit.com/r/Supplements/comments/1jfrzym/is_citrulline_malate_beta_alanine_worth_taking/,1742485752.0
"advice on intermittent tics, brain fog, and speech difficulties","Hey everyone, I’m looking for some insights or advice about a condition I’ve been dealing with for years now. I’m in my 20s, and since I was about 14, I’ve been experiencing a set of recurring issues that are really affecting my daily life. The symptoms seem to come in cycles, usually lasting for about two weeks every two months or so. Here’s what I’m dealing with:
	•	Tics: I experience eye tics (twitching), neck spasms, forearm movement, and even my ears move involuntarily at times. These tics are random and can be triggered or worsen during these episodes.
	•	Speech Problems: During these episodes, I struggle with speech. I stutter, have difficulty finding words, and sometimes can’t think of the words I want to say. It feels like my brain just can’t keep up with my speech, and I get really frustrated because I can’t express myself clearly.
	•	Fatigue and Weakness: Alongside these issues, I feel incredibly tired and weak during these periods. It’s hard to function normally because of the mental and physical exhaustion.
	•	Cyclic Nature: These episodes seem to come every couple of months, and they last around two weeks. Outside of these cycles, I feel fine, though I’m always aware of the tics, which have been present for years.
	•	No Major Life Changes: There hasn’t been any specific event that triggered this condition; it just started out of nowhere when I was 14. I’ve had blood tests done, and everything has come back normal.

I’m wondering if anyone here has dealt with something similar, or if anyone can point me toward possible diagnoses, treatments, or lifestyle changes that might help alleviate these symptoms. I’ve been trying to figure out what could be causing this, but nothing seems to fully

I want to try these: (the pic)
I took magnesium glycinate in the past and i think it might have helped me (not sure if placebo)",https://i.redd.it/g8uq15db6vpe1.jpeg,1742484932.0
Beef Organ Supplements,"Benefits?? Worth it?? I have a 6 month old and I’m breastfeeding, I’ve heard it can help with hormone balance and libido (which are some big things I’m struggling with.) Also, is there a gummy form? I have some swallowing issues and can’t swallow pills/capsules. 

The only gummy forms I’ve found are Well & Whole, Nutriissa, Velna Zivs, and Nutraperfecto. Are any of these good brands?",https://www.reddit.com/r/Supplements/comments/1jfrl2m/beef_organ_supplements/,1742484681.0
Is Creatine Hydrochloride HCI or HCL?,"I see both ""i"" and ""L"" used at the end and not sure why. Even Kaged brand uses both on the same listing! Seems HCI is used more when referencing the compound and HCL is used in things like product names.

Anyone else notice this? Am I crazy?",https://www.reddit.com/r/Supplements/comments/1jfrdll/is_creatine_hydrochloride_hci_or_hcl/,1742484143.0
What is the best supplement(s) to take with NAC?,"Taking NAC for OCD.

From past use I know it can cause me adohenia from high doses after a few days.

What can I take with the NAC to optimise its function and reduce any side effects.

Does anyone know the mechanism of this supplement and if it depletes any co factors?

Thanks Kindly for reading ",https://www.reddit.com/r/Supplements/comments/1jfr1x3/what_is_the_best_supplements_to_take_with_nac/,1742483268.0
Is there a stack I can take to increase the “pleasure” I feel?,"I was born with lower levels of dopamine, and serotonin. I made a post earlier asking for advice on the ultimate “horny, not hard” stack since I don’t have any blood flow or anxiety issues that prevent sex. If anything, sometimes I last too long.

I never get as messed up off alcohol, weed, general drugs. I don’t ever seem to get the same sexual pleasure as other men either. And I am very certain it has something to do with my genetics, and ADHD/Depression. Maybe even the 8-9 prescriptions my mom had me on for ages 9-15.

Not sure, but I figure maybe you all can reccomend some stuff for me?",https://www.reddit.com/r/Supplements/comments/1jfqsup/is_there_a_stack_i_can_take_to_increase_the/,1742482609.0
Triton MRL powder,,/r/CFSplusADHD/comments/1jf26wk/triton_mrl_powder/,1742482031.0
"What are the best supplements for anemia, low blood pressure and hemoglobin?","I was diagnosed with anemia at 15, currently 26 and still struggling with my low iron and now recently my doctor has mentioned my hemoglobin and blood pressure being low. 
Ive been taking Thorne’s Ferrasorb since June of last year and Beef Liver Supplements the last couple months but I haven’t seen an improvement. Is there anything else you recommend that will make a significant difference in my low iron, hemoglobin and blood pressure levels ? ",https://i.redd.it/mh1bgw0xwupe1.jpeg,1742481771.0
Supplements for dairy drinkers,"I've been on a low carb diet and have been doing well staying away from sugars, flower, high carb foods etc. However I am a huge coffee drinker and have replaced my sweet food addiction with heavy cream addiction. It's definitely impeding my weight loss. 
I purchased dairy aid from the company NOW. It has bitters and enzymes specifically to help digest lactose.
I'm wondering if any of you have any other recommendations or have struggled with addiction to dairy and have found a supplement that aids in weight loss while you consume dairy.
I don't consumer any other dairy products or cheese or yogurt or milk. Just heavy cream. ",https://www.reddit.com/r/Supplements/comments/1jfq6zm/supplements_for_dairy_drinkers/,1742480956.0
What's the Best Magnesium Glycinate Out There Right Now?,"Hey everyone, just a quick one.

I’ve been looking at getting some magnesium glycinate lately and I’m trying to find the best one on the market.

EDIT: Thankyou for all your recommendations, I ended up choosing to go for [this brand](https://suppadvisory.com/plantvital-magnesium-glycinate-200mg-120-capsules-review/#1), thanks!

I’ve heard good things about it for helping with sleep and anxiety, and before I buy it I'm just curious if anyone here has a go to brand or product that they swear by.

I’ve been dealing with some sleep issues recently (nothing too crazy, just not the sleeping very well), and I’ve read magnesium glycinate can be helpful for that. Also, I’ve been feeling kinda on edge more often than usual, so I thought it might help with anxiety too, since I’ve heard it can relax your muscles and calm the mind a bit.

I hear that this specific one’s the best, others swear by that one, and I’m just looking for something that’s legit, has decent reviews, and doesn’t make me feel like I just swallowed a rock.

If anyone has suggestions or any personal experiences, I’d love to hear them!

Does magnesium glycinate actually live up to the hype, or is it just another supplement that sounds too good to be true?

Any info would be awesome, TIA!",https://www.reddit.com/r/Supplements/comments/1jfq44u/whats_the_best_magnesium_glycinate_out_there/,1742480744.0
SM Sulforaphane Activated Complex vs BROQ,"SM: https://a.co/d/7vE0k7j

BROQ: https://a.co/d/hvuZFIZ

I'm just wondering if either of these have an empirical advantage over the other. I'm going to try Sulforaphane but I know that there's things to consider like precursors and sources, which both products differ on. I've familiarized myself a little bit, but I just feel like I don't know enough about what's optimal. At a glance, I feel like BROQ is superior, but I'm unsure.

If anyone understands the specifics of sulfuraphane, I'd appreciate some input.",https://www.reddit.com/r/Supplements/comments/1jfq07l/sm_sulforaphane_activated_complex_vs_broq/,1742480439.0
Tongkat Ali,"I was taking Tongkat Ali from Momentous for a month and absolutely killing it at the gym 6 days a week alternating running and weights, dropping decimals in body fat approaching 10% flat without loosing muscle, mostly staying green on whoop recovery, etc. Ran out in between deliveries and this week has been weak af. This next order also includes Ashgawhanda, magnesium malate and fish oil which I was taking from some random Amazon brand before. We'll see. 
I just wanted to share that. ",https://www.reddit.com/r/Supplements/comments/1jfpxfp/tongkat_ali/,1742480226.0
