title,text,url,date
"Non-Stim Energy? Looking to Reduce Caffeine Intake (and PEA, Alpha GPC etc)","Hi all,

Looking to un-fry my dopamine receptors, but I am v lethergic (have PTSD and fibromylagia) 

I'm looking at the likes of ashwaghanda, rodeola rosea, gingko, crodyceps etc.

  
Any other supplements/herbs that can help?

  
Are there any decent ""all in 1"" supplements? 

Thank you :) ",https://www.reddit.com/r/Supplements/comments/1jdce9c/nonstim_energy_looking_to_reduce_caffeine_intake/,1742217428.0
Dye free energy supplement?,Looking for a pre-workout or energy type of supplement that is dye/food coloring free. Bonus points for aspartame free. Any recommendations? ,https://www.reddit.com/r/Supplements/comments/1jdc4od/dye_free_energy_supplement/,1742216624.0
Significant mood boost with vegan omega 3 but causes bloating,"As the title says, vegan algae omega 3 high in DHA gives me significant energy and mood boost that I didn’t expect. I never got this effect from fish oil. But the only drawback is BLOAT. Like not even just a little bit I look 4 months pregnant when I’m relaxed. This didn’t happen with fish oil. Does this happen to anyone else? And why? I first thought it was the carrageenan in the first one I tried so o switched to one without but I still have the bloating. I don’t want to stop bc I love the way I feel but the bloating suck. Does it eventually go away or will it continue? I take it on an empty stomach if that matters. I’m going to try it with a meal tomorrow to see if there’s any changes. ",https://www.reddit.com/r/Supplements/comments/1jdb3x3/significant_mood_boost_with_vegan_omega_3_but/,1742213383.0
Taking Life Extension Multi with Copper Supplement?,"I understand that Life Extensions has a high amount of Zinc, which can cause a copper inbalanace, and as far as I know this Multi doesn't include Copper.

Should I supplement Copper alongside this multi? if so, how much and does anyone have brand recommendations? thanks. ",https://www.reddit.com/r/Supplements/comments/1jdb30t/taking_life_extension_multi_with_copper_supplement/,1742213295.0
Nattokinase,"Started nattokinase at 2000 in

Side Effects

Chest tightness 
Sore Chest, body
Fatigue
Upper backache

Anyone else experienced something similar? If yes, is it some detox effect and how long will it last? ",https://www.reddit.com/r/Supplements/comments/1jd9v3h/nattokinase/,1742208915.0
An alternative to coffee for a morning dopamine boost,"I’m on an antipsychotic which dampens dopamine receptors (currently tapering off it) so if I don’t have my coffee in the morning I feel really flat and emotionless. Ironically, stopping caffeine will help me to be able to come off the antipsychotic more quickly. Is there something I can take in the morning that will give me the dopamine boost without the caffeine? ",https://www.reddit.com/r/Supplements/comments/1jd8qzt/an_alternative_to_coffee_for_a_morning_dopamine/,1742204320.0
Best supplements for work outs Calorie intake,"I'm after a bit of advice for my partner, she's 56 and weighs under 7stone. she does treadmill everyday and keep fit. All at home.  She's burning way more calories then she takes in. only eats small amounts in the evening. She would like some drink type supplement that will help build her weight back up. and  you mix with milk. Thanks in advance from the UK",https://www.reddit.com/r/Supplements/comments/1jd7wtv/best_supplements_for_work_outs_calorie_intake/,1742200377.0
Expired creatine - Can i still use it?,"It's 5 months expired.. i don't see any mold, but it's hardened. if i break it and use it will i still get the same benefits?  does it loose it's potency? 

And where is the best place to store it? i live in a hot environment ",https://www.reddit.com/r/Supplements/comments/1jd6nlv/expired_creatine_can_i_still_use_it/,1742194461.0
One A Day Women’s pills,"My mum is forcing me to take one a day and am just confused if I have to or not. Any views on its benefits, effects? Be it positive or negative, I just want to have a broader view about it and then start with it. ",https://www.reddit.com/r/Supplements/comments/1jd4nrv/one_a_day_womens_pills/,1742186084.0
how much magnesium to take with vitamin D?," am taking 200,000 IU loading dose of vitamin D once weekly. I will continue to take it for 3-4 weeks.

So how much magnesium should i take along with it? Is 200 mg less?",https://www.reddit.com/r/Supplements/comments/1jd4k3l/how_much_magnesium_to_take_with_vitamin_d/,1742185702.0
recommendations for small melatonin tablets/caplets,"hi! my meds make it hard for me to sleep so i’ve been taking 5-10mg of melatonin at night. i’ve been taking gummies but the aftertaste is annoying especially if i already brushed my teeth, but i hate big pills. does anyone have recs for small-smedium melatonin tablets or caplets? thanks! ",https://www.reddit.com/r/Supplements/comments/1jd3wbm/recommendations_for_small_melatonin_tabletscaplets/,1742183305.0
NAC - feeling like being on a boat?,"I started taking NAC (600mg before breakfast and 600mg before bed) and 1-2 hours after my morning pill - I start feeling a bit dizzy have vertigo issues - like walking on a boat! It sometimes comes with a little nausea and just a general weird feeling. 
I‘m very susceptible to vertigo and get extreme motion sickness (in cars, boats etc) so the feeling isn’t new to me. 
I tried taking it with food which seems to be much better but I‘ve read it isn’t absorbed as well. Can anyone relate? Is it okay to have it with food? ",https://www.reddit.com/r/Supplements/comments/1jd3uns/nac_feeling_like_being_on_a_boat/,1742183147.0
How did you know what supplements to start taking?,"I am just starting to take supplements for the first time. Just basic vitamin D with K2 and vitamin c. My D was super low at 18, so I’m taking 10,000 IU a day. 
I am female in mid 30s and just have no idea where to start. If there are supplements that help with energy, focus, blood circulation, dry skin, rosacea, Id be interested. Or just general health, vitamins for women. Thanks so much. ",https://www.reddit.com/r/Supplements/comments/1jd3j46/how_did_you_know_what_supplements_to_start_taking/,1742182042.0
Mom put DIM in the fridge for a few days.,"My mom put my DIM-Evail in our fridge for a few days and I’m worried it won’t be as affective now. It says store at room temp on the bottle, and I can’t find any info on this, please help! She also put my inositol and vitex in the fridge, but those say store in a cool dry place so I’m assuming that’s fine? These are so expensive I’m hoping I can still take them. ",https://www.reddit.com/r/Supplements/comments/1jd2fzb/mom_put_dim_in_the_fridge_for_a_few_days/,1742178514.0
Help me understand the nutritional values,"https://preview.redd.it/eev31zcdl5pe1.jpg?width=3024&format=pjpg&auto=webp&s=cf5d1b8302ba1441d7b78416b5db715edba27e4d

Theres a lot of values there. 950 mg then suddenly 117.15mg

Im confused here. How much magnesium is there per pill?",https://www.reddit.com/r/Supplements/comments/1jd1env/help_me_understand_the_nutritional_values/,1742175247.0
Creatine making me feel weird??,"Hi! I started taking creatine around February, was consistent for a few weeks but kind of forgot to keep on top of it all the time. Anyways, I noticed that sometimes when I take it, I get suuuuper on edge. I have ADHD, and when I was prescribed meds, one time I took them and had a coffee a couple hours in and felt sooo disoriented and sick - which is like how I feel now on creatine. I’m not sure if maybe it’s just this brand, as I was reading similar issues that other people had that had been resolved by trying a different brand, but I’m wondering if it’s worth even trying a different brand of this is something that other people experience and I just can’t tolerate it?
My brain feels super foggy even typing this, kind of like when you’re high or tipsy but not having a good time with it lmao",https://www.reddit.com/r/Supplements/comments/1jd0kkj/creatine_making_me_feel_weird/,1742172637.0
Is it dangerous to use methylene blue and atomoxetine together?,"I have both cfs and adhd and I think I probably have mitochondrial problems. (Of course, I can't say it's a sure cause)

So I thought I'd try Atomoxetine for my adhd and Methylene blue for my cfs (mitochondrial dysfunction?)

But it seems methylene blue is also a maoi.

I'm not familiar with maoi, but is it dangerous to take methylene blue and atomoxetine, or even some sleeping pills, at the same time?

Also, I really want to cure my cfs (I also have delayed fatigue after exercise, so I'm pretty sure it's cfs), so please let me know if there are any other treatments you recommend. I've tried the well-known ones like ldn, so I'd like to know if there are any drugs or substances like methylene blue that haven't been tried by cfs patients but are actually useful).

My life is messed up by cfs, so even if there's a certain risk, I want to cure my cfs anyway.",https://www.reddit.com/r/Supplements/comments/1jd08dq/is_it_dangerous_to_use_methylene_blue_and/,1742171623.0
Oregano oil capsules,"What do we think about supplementing with oregano oil in veggie capsules ? 

Have you had success with it in the past ? 

Any negative experiences?

I’m currently taking 4 drops in a veg capsule 1x/day and see improvements in my allergic symptoms, probably gut related ",https://www.reddit.com/r/Supplements/comments/1jcyb9e/oregano_oil_capsules/,1742166152.0
Solutions: Creatine Sleep Issues,"I posted a comment a year or two ago where I resolved sleep issues on creatine by switching to a different formulation. As far as I know, no one else has posted a solution outside of dosing creatine monohydrate earlier in the day, and the solution itself is surprisingly simple. 

Formatted for brevity.

**Step 1: Ignore anyone who says Creatine does not cause any sleep problems.** There is plenty of documention from folks experiencing the same. There are subjective experiences on the Internet that date back for years, so it’s poor reasoning that others feel this is some sort of conspiracy.

**Step 2: Switch from Creatine Monohydrate to Creatine HCl or CGP Creatine.** Taking either of these alternative formulations, I did not have sleep issues.

**Step 3: Enjoy your sleep.** If either of the creatine formulations don’t work for you, there are plenty more alternative formulations you can keep trying (eg Magnesium Creatine Chelate, etc), until you find one that does work for you. Initially I thought it was the brand, so I switched between different brands of monohydrate, but it was actually the formulation that was the issue for me.

**What if the solution does not work?**
If you persist in your sleep issues after trying multiple alternatives, it is likely not the formulation that is the issue, but the creatine itself— at which point it’s likely better to stop dosing creatine altogether.",https://www.reddit.com/r/Supplements/comments/1jcy818/solutions_creatine_sleep_issues/,1742165918.0
Is magic mind worth it?,"Couldn’t find the dosage in the ingredients, anyone try this? ",https://i.redd.it/c068sh34s4pe1.jpeg,1742165374.0
Supplement advice for a growing dude!,"“Growing dude” might be a bit of an exaggeration for my age, but I’m determined to transform my body, especially during my final term of university. I’m a 29-year-old Filipino man, and I’m on the chubbier side, weighing around 105 kilograms. My goal is to achieve the physique of a roadhog from Overwatch, prioritizing functional strength over aesthetics.

I’ve been consistently going to the gym for almost three months now, and this is the longest streak I’ve ever maintained. I’m incredibly proud of my progress. Currently, I’m following Torokhtiy’s Weightlifting and bodybuilding routine. While I’ve done routines in the past few years, I’ve always had a tendency to give up once the program ends.

My diet has been on track, ensuring that I’m getting enough protein. Most days are successful in meeting my nutritional goals, but there have been a few instances where it’s been a bit of a struggle.

As for supplements, I’m currently taking 10 grams of creatine per day with 2 portions of protein, but that’s the only two supplements I’m using.

So, I’m seeking advice on what other supplements I should consider incorporating into my routine to support my fitness goals. 

Edit: forgot to add - my goals are just to build muscle!",https://www.reddit.com/r/Supplements/comments/1jcxgdt/supplement_advice_for_a_growing_dude/,1742163774.0
Magnesium Glycinate + CBD/THC For Sleep,"Anyone use this combo for sleep or insomnia?

It’s really been helping me lately, but now I’m wondering if there are any risks I should be aware of. I could also just be overly paranoid…

Magnesium - 200mg
CBD - 12mg
THC - 1 mg",https://www.reddit.com/r/Supplements/comments/1jcxfsy/magnesium_glycinate_cbdthc_for_sleep/,1742163728.0
Is Creatine and Glutamine effective when fasting?,"As the title states: I am currently doing a wet fast for Lent. I don’t eat anything until 5pm. I also do workout throughout the week and my goal is to have muscle growth mainly in my lower body. If I were to take these supplements on an empty stomach, will I still reap its benefits? Especially since I’m not eating as much (protein) as I should?",https://www.reddit.com/r/Supplements/comments/1jcx6w9/is_creatine_and_glutamine_effective_when_fasting/,1742163065.0
Supplements to prevent potential altitude sickness,As the title says. I am getting ready for a high altitude trip in two weeks. I don’t want to get hit with the altitude sickness. I want to start taking something to prevent it. What did you use? What did you find helpful? Thanks. ,https://www.reddit.com/r/Supplements/comments/1jcx4e6/supplements_to_prevent_potential_altitude_sickness/,1742162876.0
Magnesium Glycinate,"Started taking magnesium glaciate 200 mg every night for stress about 16 months ago. 4 months in notices slight tingling in my foot. Fast forward a year both feet feel tingly, I have bad pain by my ribs back left side and stiffness in the QL muscle area, and weird on and off buzzing feelings. All blood work looks normal, and no other symptoms. I stopped taking it 4 days ago after putting the timeline of onset and magnesium together. It’s less that it was so I feel encouraged but how long to feel normal again?! It’s driving me crazy.",https://www.reddit.com/r/Supplements/comments/1jcww79/magnesium_glycinate/,1742162274.0
Intrusive thoughts. Help,"I have the worst intrusive thoughts. They take up most of my day and I can’t deal with it anymore. They are mostly harm intrusive thoughts. 

Anything to help.  

Ugh I wish I knew why this happened ",https://www.reddit.com/r/Supplements/comments/1jcver0/intrusive_thoughts_help/,1742158270.0
Anyone try Microingredients brand creatine?,Just wondering if this brand is safe or if there are better brands I should go with,https://i.redd.it/ug4k9wm934pe1.jpeg,1742157022.0
Stack Feedback,"24 F active lifestyle and struggling with general fatigue brain fog and extremely poor sleep also diagnosed POTS which im on metoprolol and guanfacine for i want to get my vit b12 D and iron levels up. I have some issues with food and there are just a lot of foods i dont eat so i definitely want to cover for my restricted diet, i eat lots of chicken most fruits and some starches and sweets, broccoli is the only veggie i eat most of the time and I eat beef and pork and tofu less frequently and I do not eat fish but i do eat seaweed.

I'm looking to restart my vitamin stack as i did not end up liking the vitamins i was previously using, garden of life, extremely smelly, expensive and i found out they're owned by nestle. I am particularly trying to avoid excessive B6 and am looking something covering all trace minerals I might need and using optimal forms of vitamins.

I was looking at the [life extensions prenatal advantage](https://www.lifeextension.com/vitamins-supplements/item02319/prenatal-advantage) to start because it has pretty much everything i could think of and it also does not mega dose on every vitamin. Im not pregnant it just seems like a good formula Alternatively I was considering getting [this ](https://www.lifeextension.com/vitamins-supplements/item01328/only-trace-minerals)trace mineral complex but im not sure which things i would want to add to this in that case,does anyone have a suggestion for a fat-soluble vitamin complex to go with this? between that or the prenatal which would be better?

Am also considering adding the following

Iron [nutricost iron for women ](https://www.amazon.com/Nutricost-Women-Capsules-Vitamin-Folate/dp/B09XZJYD4Y)\- this complex looks best since it also has vit C methylb12 and folate i would be taking every other day i am a little worried the 27mg of iron in the prenatal will interfere with absorption?

[D3 with k2 and iodine from life extensions ](https://www.lifeextension.com/vitamins-supplements/item02040/vitamins-d-and-k-with-sea-iodine)\- not sure if the 1000IU from the prenatal is going to be enough to raise my levels, I read that you're supposed to take vitamin D with K but is it really ok to take this much?

Boron 2mg/day considering this but on the fence there seems to be pros and cons

Fish Oil/Omega 3s - TBH im still really skeptical i actually need this and also dont see myself choking down 6 pills a day of just fish oil

I am also taking magnesium glycinate avg 100mg a day and lots of electrolyte drinks as needed to keep hydration up nothing fancy just sodium and potassium.

Any feedback or suggestions for alternate brands is appreciated!",https://www.reddit.com/r/Supplements/comments/1jcuu0d/stack_feedback/,1742156722.0
Any good supplements for focus?,I haven’t been diagnosed with anything despite going to two therapists so I don’t have adhd or anything of that matter so adderall would be way too much for me not to mention it is prescription. I see so many supplements online for focus and it all seems like a scam to me. I’m just wondering if anyone has personally tried something specifically to help me focus/be motivated on my homework. I’m not gonna trust a company selling the product I need personal experiences. It could be a daily thing for the entire day or just to help for a few hours. I know motivation is mental but I think it would improve if the homework didn’t take hours to do because there is always something. I use caffeine when I do homework but it doesn’t really improve my focus. It improves a little bit not enough to make homework efficient. I am 18 so hopefully that broadens what I can use. I don’t have a med card so I can’t use cannabis. I also drive a lot so it wouldn’t be useful anyways,https://www.reddit.com/r/Supplements/comments/1jcumtn/any_good_supplements_for_focus/,1742156199.0
NAC first time,"Hello, I bought for the first time NAC after seeing a lot of good things on this sub about it. Today i took 1600mg for the first time and man my mind is so clear and I feel like my sinuses have cleared, actually I feel like amazing, my nose is usually often congested but today nothing after taking it. But the thing i noticed is my breath smells like really bad like rotten eggs and my sweat also smells like rotten eggs my mom even asked me if i ate garlic XD. I also produce more saliva i feel like.",https://www.reddit.com/r/Supplements/comments/1jcuil1/nac_first_time/,1742155885.0
Potassium Help: who takes more?,I have read that they only allow producers to put 99mg in their supplements as it can be severely dangerous if we take too much. I also know that it's recommended that you get your main supply of this vitamin from your diet via food/drink however I'm wondering if anyone here supplements more than 1 pill (99mg) a day safely. It seems like the daily recommended amount is pretty high and honestly in order for me to make that mark I'd have to be shoveling in larger amounts of potassium rich food than I already eat; I'm on a diet to get in shape for summer so eating more food is not gonna happen. Anyone here have any experience or good/bad results from supplementing it?,https://www.reddit.com/r/Supplements/comments/1jcu4mo/potassium_help_who_takes_more/,1742154885.0
"5,000 iu vitamin d3 and k2 daily?","im sure this has been asked before somewhere. i did my bloodwork recently and my vitamin D levels dropped more than last year so now im defecient. was at 22L last year and now 17 L

started taking a supplement that has both d3 and K2 . 5,000 IU D3 and 180 mcg of K2

im taking this for 4 days already. until i see the dr. 

basically just asking if this is ok dose daily for someone deficient.",https://www.reddit.com/r/Supplements/comments/1jctp2m/5000_iu_vitamin_d3_and_k2_daily/,1742153780.0
Does magnesium need thiamine? Or just the other way around?,"
I historically have not tolerated magnesium well and I have a bunch of symptoms of deficiency (chronic constipation, poor blood sugar regulation, brain fog, hormonal imbalances, muscle cramps/twitches, etc.) 

I want to try again (eek) much slower—even though before, I only had ~300mg which caused a reaction. (My negative response was a huge wave of anhedonia, blankness, dissociation; which I’ve since read happens to other people too.) 

I have seen posts and comments about thiamine. I’m cautious because it’s a histamine liberator and I have histamine intolerance/MCAS. From what I’ve read, it looks like thiamine can deplete magnesium… but is it the other way around too? Does magnesium “need” thiamine?

For context, I’m an undermethylator and as I said, have hormonal imbalances and MCAS. I eat low carb because I’m insulin resistant. 

Thank you ",https://www.reddit.com/r/Supplements/comments/1jctcxy/does_magnesium_need_thiamine_or_just_the_other/,1742152910.0
Greens vs energy drinks,"Hi everyone! I want to preface this by saying I know that neither greens or energy drinks are great options, but I need a caffeine source (I don’t like coffee unfortunately). I’ve taken the better days caffeinated greens before and enjoyed those but have been on a daily Alani nu kick. Which  would be better to have on a a daily basis? TIA!",https://www.reddit.com/r/Supplements/comments/1jct0w3/greens_vs_energy_drinks/,1742152060.0
What makes you pick the Pre Workout you take?,"Do you choose the Pre Workout based on
Ingredients? Like me and a nerd and want results
Reviews? Heard it was good so try it
Influencer? Some person you follow recommended it
Flavor sounds interesting? 
What are your top 3-5 reasons?",https://www.reddit.com/r/Supplements/comments/1jcsxle/what_makes_you_pick_the_pre_workout_you_take/,1742151822.0
DHEA,"I have been reading about dhea and this could be beneficial to men over 30, any thoughts or experiences you can share?",https://www.reddit.com/r/Supplements/comments/1jcsgkn/dhea/,1742150654.0
Rate my stack 🤲🏽,"So in a week I pretty much take everything but over different days. 
Typical morning has Ginseng, Vit B, Vit C ,Carnitine , Shilajit, L Arg and Maca. The rest I take  in the evening after dinner which is usually my first proper meal.

I take Berberine the days I’m sluggish and not working out.
I occasionally take Psyllium husk, probiotics and collagen.
I take a single oral shot of Dibase 25000 IU of Vit D once a month … the rest of the Vit D I get from the 1000 IU in the fish oil capsule.

I have on re-order Creatinine. 
",https://i.redd.it/ycxab123j3pe1.jpeg,1742150233.0
Natural supplement to suppress anger /irritability?,"Hello , is there any natural supplements that can help handle anger or irritation outbursts ? Lately I’ve been feeling easily irritated, and get angry at things easily , way more easily then I used to . I used to be so calm in the past , I know my mind is busy and lots more to do these last few years but are there any good known supplements to help keep a calm mind and not get irritated by lots of stuff or just to control this angry irritated feeling ? I have no idea what’s causing it . I did do some pro hormones a few years back and had some random bouts of stuff like this but now it’s been months and it feels like it’s getting worse , more snappy , little things irritate me more now and I seem to be more of an asshole I feel
Like . Thank you ",https://www.reddit.com/r/Supplements/comments/1jcrs62/natural_supplement_to_suppress_anger_irritability/,1742148904.0
Can i take spearmint and maca root together?,both have an effect on hormones so i wanna make sure it’s safe. maca root is a hormone balancer and spearmint reduces testosterone/androgens. i’ve been taking maca for awhile now but i just started spearmint today for hormonal acne ,https://www.reddit.com/r/Supplements/comments/1jcr6d7/can_i_take_spearmint_and_maca_root_together/,1742147347.0
