title,text,url,date
Best overall creatine monohydrate powder for the price?,"I'm looking for a creatine monohydrate that is 3rd party tested, 3-5 gram servings

I've heard that Steelfit, PEscience, Transparent Labs with HMB, Thorne and Nutricost are reputable brands. Also, Jacked Factory seems to be a quality product for the price. Obviously Thorne is a top contender but it's always so expensive. Any advice? Thanks! ",https://www.reddit.com/r/Supplements/comments/1jmscvr/best_overall_creatine_monohydrate_powder_for_the/,1743271708.0
Supplement guidance please,"My naturopath has recommended a treatment plan which includes 6 supplements. Im feeling a bit uncomfortable with starting all 6 right off the bat. Im currently experiencing stress, high anxiety, cognition and sleep difficulty.

I noticed some of the supplements seem to target similar concerns, so my thinking is: why not start with 3–4 (like one for anxiety, one for sleep, etc.) and then add others later if needed? That way I can actually tell what's helping and avoid unnecessary side effects.

Supplements recommended:

\- Ashwagandha

\- Magnesium bisglycenate

\- Omega 3 w/Vit D

\- Gaba-T-SAP

\- Cortico-Calm Matrix

\- Mitochondrial Formula (Bioclinic)

Would love to hear which ones youd recommend I begin with thanks!!",https://www.reddit.com/r/Supplements/comments/1jmsbwx/supplement_guidance_please/,1743271633.0
Cheapest protein powder per serving?,"Hey guys, I was really used to the sales on TikTok and other places that got my protein down to about $0.38 per serving but that well seems to have been sucked dry. Now the same bag that I could pick up for around $70 is about $109 with no sales on the horizon. 

Cheapest I can see is around $0.7 in this market.

I like unflavored and I like to buy in bulk to I’m wondering if anyone has some recommendations on keeping costs low and preferably quality high. 

Thanks",https://www.reddit.com/r/Supplements/comments/1jms3m6/cheapest_protein_powder_per_serving/,1743271031.0
L tyrosine,Is two grams of l tyrosine too much in pre workout? I’ve been nonstop on it for almost two months. ,https://www.reddit.com/r/Supplements/comments/1jms2o0/l_tyrosine/,1743270960.0
Anyone experienced nightmares because of supplements?,"I’ve been having terrible nightmares every night and am trying to figure out if something besides everyday stress could be causing them. Has anyone experienced this due to supplements? I take ashwagandha, NAC, magnesium glycinate, and melatonin nightly. I stopped everything except melatonin for the past two nights, and it seems to have improved—I’m at least not waking up with vivid memories of the nightmares. Not sure if this is a placebo effect or if I’m completely overthinking it. Would love to hear if anyone else has had a similar experience!",https://www.reddit.com/r/Supplements/comments/1jmrd6z/anyone_experienced_nightmares_because_of/,1743269097.0
Vit d3 + K2 - Feet burning- Neuropathy,"Anybody else experienced that? There are so many theories that Vitamin K2 activates matrix gla protein, which removes excess calcium from the body and uses up magnesium in the process. This creates magnesium deficiency and subsequently, one experience feet/hand burning and (neuropathy).
Thanks",https://www.reddit.com/r/Supplements/comments/1jmqr0u/vit_d3_k2_feet_burning_neuropathy/,1743267480.0
Stack advice,"Hello. I've been wanting to post something for awhile, but have feared that you'll all think I'm nuts. 
Quick background: 55 year old man, had the trifecta (type 2 diabetes, hypertension, high cholesterol) for about 20 years. About 18 months ago, tweaked my diet, started 3 or 4 supplements, got functional health blood tests. Started a massive amount of supplements to address energy, CV health, diabetes, cognitive health, focus, libido, ED and hormone imbalances. Most of my biomarkers have improved, but I'm trying to remove redundancy from my stack. I made the mistake of adding everything at once, making an analysis of efficacy trickier. 
I'd love some feedback and dialogue on my stack...whether on brand, redundancy in my stack, efficacy, etc. Thought I could learn a lot from all of you and others might too. My stack is linked here:
 https://supp.co/u/e3c-op94u_e5zfwy/products?st=1hsm6d&utm_source=share&utm_content=st
I figured that would be easier than listing 57 products in an already lengthy post. Hope I'm not asking for too much and thanks in advance for advice. (I'm also reading up on Consumerlab.com, examine.com, supp.co, and using Perplexity AI, but wanted to get thoughts from this community)",https://www.reddit.com/r/Supplements/comments/1jmqmji/stack_advice/,1743267137.0
Nello Supercalm,Has anyone tried this? I see it promoted a bunch on tiktok and ordered it through amazon. Had it the last two nights before bed and had a very restful nights sleep - wondering if its worked for anyone else?,https://www.reddit.com/r/Supplements/comments/1jmqjzp/nello_supercalm/,1743266943.0
Guys is this too much?,,https://www.reddit.com/gallery/1jmpyau,1743265334.0
In need of supplement recommendations,"Hello i am 28y Male, i do go to the gym and play sports actively i am in search for some supplements to improve my health, Currently i use Whey protein and Creatine, and planing to add Magnesium, Omega3, D3 K2. I would be grateful for any suggestions thank you",https://www.reddit.com/r/Supplements/comments/1jmpdov/in_need_of_supplement_recommendations/,1743263781.0
Vitamins,"Make 37
What’s your opinion on this? ",https://i.redd.it/6gm2ni9ngnre1.jpeg,1743263246.0
I think this is all safe to take together? Would like insight,"I'm trying to lose weight,  build muscle, and increase testosterone and sex life. My primary concern is,  is this too much ashwagandha? Or anything else that concerns any of you? 

Edit:  images uploaded. Link provided.

https://postimg.cc/gallery/5v2Nr44",https://www.reddit.com/r/Supplements/comments/1jmowyc/i_think_this_is_all_safe_to_take_together_would/,1743262499.0
Health testing,"I came across an ad on Reddit for Function Health. It peaked an interest. It says HSA eligible and I do have an account that could cover the cost so the cost is not a huge concern although it is a mild deterrent. 

I do annual testing through my PCP but he just does the basics, CMP, CBC, lipid panel, and thyroid (because I am hypothyroid). 

I googled and I see there are similar companies but I’m having a hard time finding information without giving them my information. 

Has anyone used a company like this? Experience? 

",https://www.reddit.com/r/Supplements/comments/1jmokwl/health_testing/,1743261576.0
Focus is gone. Need Your Guys' Help Desperately!,"Hey guys. Love this forum and all your helpful insights. Am just reaching out because I'm at a point in life(mid 30s professional who recently started an accounting job) where my mind's focus is so poor, it's a wonder I'm able to get one thing accomplished before being pulled away to something else. I drink coffee regularly and in the past have tried things like Olly Focus Vitamins, green tea, L Theanine, Neuriva, and other things to help but nothing gives me the concentration and retention I need to function. Have been to psychiatrists and one absolutely refused to believe I had ADHD because I was good in school academically and didn't start having focus issues into adulthood, while the other prescribed a medication that did help but upped my blood pressure and I had to discontinue it. 

Please let me know of things that have worked for you. Sorry to be asking this question for no doubt the umpteenth time.",https://www.reddit.com/r/Supplements/comments/1jmojxs/focus_is_gone_need_your_guys_help_desperately/,1743261501.0
does zinc really require copper,"many here recommend taking copper with zinc. But is there really strong evidence that zinc reduces copper levels? Copper is also readily found in foods, our tap water also contains copper, if im not mistaken roughly 2mg per litre, and the recommended amount of water to drink is 3L

Considering excess copper can cause SERIOUS damage, why are people here so adamant on taking 1mg of copper with 15mg of Zinc?

i am considering taking 10mg zinc daily, long term, without copper. thoughts?",https://www.reddit.com/r/Supplements/comments/1jmoibl/does_zinc_really_require_copper/,1743261379.0
Binders.,"I was on a Lyme/EBV protocol for a while from a functional doctor and was taking a LOT of stuff. I only ever felt marginally better and felt that I was being gouged so I tapered off all of it and now only take what I felt helped the most. I took a whole bottle of the CellCore BioToxin Binder and, intuitively, I feel like it (not it specifically, but a binder in general) should be helpful. I feel like there's stuff inside that needs to come out. But, I never felt anything, never saw anything, it felt like exactly nothing. If anything, my brain fog is a bit worse, though not markedly. 

I would like to keep taking a binder (I'm looking at Codeage on Amazon) but I'm not sure what I need to do to maximize it's benefit or, rather, to feel or see any effect from it at all. I don't have ready access to a sauna so that wouldn't be an option. 

One of my biggest issues is that I really don't see or feel benefits from anything I do, any body work, or supplement, or anything. I pretty much just feel the same. It's frustrating but I guess there's nothing to do but keep trying. I want to see something but maybe that's too big of an ask? Or maybe it's meant to be so gradual as to not really see much at all until months or years later. I'm not sure. If that's the case, it sure is hard to be consistent and stick to it.

So, any ideas on binders? I'm just not sure what I should be seeing or what I should be doing to maximize them. Thanks!",https://www.reddit.com/r/Supplements/comments/1jmoefn/binders/,1743261090.0
Daily multivitamin,"Looking at daily multivitamins. Does this one look decent. 

https://shop.bodybuilding.com/products/bodybuilding-com-signature-multivitamin-v2?_pos=5&_sid=12860f695&_ss=r ",https://www.reddit.com/r/Supplements/comments/1jmntu1/daily_multivitamin/,1743259518.0
"Testosteron very low, please help!","Hey everyone, I recently had my bloodwork done (mostly just for fun), and what can I say—it’s pretty bad. My testosterone levels are really low for a 23-year-old athlete. I go to the gym four times a week and do 30 minutes of cardio every morning. All my nutrients and vitamins are definitely covered, and my diet is typical for a bodybuilder.

The only thing that could be suppressing my testosterone is the fact that I’m currently quite fat (20% body fat) and in a significant calorie deficit (beginning of a cut). Still, these levels are definitely not normal, and I want to do something about it.

Additionally, my estrogen is extremely low (check my full bloodwork), as well as my LH. I have two ideas:

1. Tongkat Ali
+ Better for LH and free testosterone
+ ""Safer,"" lower chance of side effects
- Doesn’t fix my extremely low estrogen, could even make it worse

2. 25mg DHEA + 10mg Pregnenolone
+ Would definitely solve my estrogen issue
+ Has the potential to be much more effective
- Might not work at all if the issue isn't related to DHEA or Pregnenolone
- Higher chance of stronger side effects and suppression of natural hormone production (though very low at this dose)

What would you recommend?




Bloodwork:
https://drive.google.com/file/d/1AbajBv_nq1XL0-W7yPwHXKrsM1U9Pfjx/view?usp=drivesdk",https://drive.google.com/file/d/1AbajBv_nq1XL0-W7yPwHXKrsM1U9Pfjx/view?usp=drivesdk,1743256369.0
Water digestion with creatine,"I recently started taking 5-10mg of creatine and ive wondered if drinking all the water before I take my daily scoop of creatine matters or if I can take it and drink all the water after I’ve taken it would it affect my gains? Sorry if I can’t explain it as well. Example, I drink 5 bottles of water during school, go to the gym and workout come back home to take my scoop for the day and drink like 3 bottles when I’ve already taken my creatine for the day then sleep and repeat, I feel like I’m doing something wrong, can anyone help?",https://www.reddit.com/r/Supplements/comments/1jmmcv5/water_digestion_with_creatine/,1743255140.0
Rate My Supplement Stack?,"Creatine Monohydrate - I take 5g in the morning. I take this supplement to make faster progress in the gym, and have an improved mood.

Caffeine - I take 125mg±75mg no earlier than 1 hour after waking up, and no later than 10:00 AM. I take this supplement to make faster progress in the gym, and have improved cognitive performance.

Magnesium Glycinate - I take 200mg in the evening. I take this supplement to maximize my natural testosterone, and get better sleep.

Ashwagandha - I cycle this supplement by taking it for 2 weeks, then stopping it for ≥2 weeks. I take 450mg in the evening. I take this supplement primarily to lower stress and increase total testosterone.

L-Theanine - I take 200mg roughly 45 minutes before going to sleep, only on nights when I feel as though I need it. I take this supplement to get better sleep and experience less stress at the end of the day.

Melatonin - I am currently working on getting my dose either ≤0.5mg or removing it entirely from my stack. I take 0.75mg±0.25mg roughly 45 minutes before going to sleep, only on nights when I feel as though I need it. I take this supplement to get better sleep.   


Generic Men's Multivitamin -I take this supplement in the morning. I take this supplement to lessen the chance of being deficient in any key vitamins or minerals.",https://www.reddit.com/r/Supplements/comments/1jmmc0k/rate_my_supplement_stack/,1743255069.0
"How much of this would you take ? Recommended dose is 2 capsules a day, one capsule is 15mg zinc",,https://i.redd.it/m14bsd31rmre1.png,1743254632.0
Is MCS FORMULAS or ONENERGY trustworthy for supplements?,"I really want to try liposomal luteolin but there aren't many sellers in europe. Due to safety concerns I never even bought supplements from outside my home country (Germany). I found [https://www.mcsformulas.com/vitamins-supplements/luteolin-pro-liposomal/](https://www.mcsformulas.com/vitamins-supplements/luteolin-pro-liposomal/) (from the Netherlands) and [https://www.onenergynutrition.de/luteolin](https://www.onenergynutrition.de/luteolin) (from Slovenia) but I haven't heard much about either of the companies. Does anyone have experience with them, maybe even with other supplements from them?",https://www.reddit.com/r/Supplements/comments/1jmlz3a/is_mcs_formulas_or_onenergy_trustworthy_for/,1743253930.0
Rapid heart rate from supplements?,"Hello,

About 8 weeks ago, I suddenly developed an alarmingly fast heart rate - around 110 beats per minute at rest, which worsened when I stood up. This started after I'd been sick twice, so I suspected that might be the cause. I went to the ER, and later saw a cardiologist who confirmed there was nothing wrong with my heart. Blood tests revealed I was deficient in both iron and vitamin D. My doctor prescribed 325mg of ferrous sulfate twice daily and 4000 IU of vitamin D3 twice daily.

Only three days after starting the supplements, my heart rate began to decrease. Instead of a constant high heart rate, I only experienced occasional palpitations when tired, and even those completely disappeared about two weeks into taking the supplements. I went about four weeks without any heart issues and was getting back to normal.

However, last week I caught a common cold, and I'm not sure if it's related, but my heart rate has started climbing again. My resting heart rate is now around 100 bpm. I'm trying to figure out if this is caused by the supplements or something else.

Current medications:
- 325mg ferrous sulfate twice daily
- 2000 IU vitamin D3 twice daily
- 200mcg vitamin K2 as MK7 (I stopped taking this yesterday because I heard it can cause tachycardia)
- 240-480mg magnesium daily (mostly taking 240mg)
- Potassium chloride (prescribed by my doctor, but I only take it about 3 times per week)

Any insight would be greatly appreciated.​​​​​​​​​​​​​​​​",https://www.reddit.com/r/Supplements/comments/1jmli28/rapid_heart_rate_from_supplements/,1743252376.0
Male 37,"Looking for a good overall multi vitamin. I’m healthy but looking for something to boost my health from getting sick. I workout daily and athletic… 

Let me know opinions.",https://www.reddit.com/r/Supplements/comments/1jmlh86/male_37/,1743252302.0
Can someone explain cycling to me?,"Can someone explain how cycling works?  For example, is like taking a supplement every other day?  Or is it more like one week taking a full week of one supplement then the next week taking a full week of a different one?  Something else?",https://www.reddit.com/r/Supplements/comments/1jmlfvj/can_someone_explain_cycling_to_me/,1743252172.0
Iodine rich foods,Are there any iodine rich food  other than sea food that are  easily available ?,https://www.reddit.com/r/Supplements/comments/1jmkyi6/iodine_rich_foods/,1743250468.0
Omega 3 fish oil and stinky poo?,"Basically the title, anytime I consistently take omega 3 my poop starts to stink up, I tried taking it with largest meal, less than the recommended dose (I take Nature’s Bounty brand and it says 3 soft gels a day 1200mg fish oil, 360mg omega 3 per). As long as I take it 3 days in a row the stinch kicks in..
I am not really worried healthwise as googling says it’s pretty normal but I poop on company time and feel self conscious about it in a shared bathrooms.
Just wanted to see if anyone else experienced this lol. Maybe different brands have you different experience?",https://www.reddit.com/r/Supplements/comments/1jmkucc/omega_3_fish_oil_and_stinky_poo/,1743250039.0
Why red ginseng is not mentioned here?,Is it waste of money?,https://www.reddit.com/r/Supplements/comments/1jmjc0k/why_red_ginseng_is_not_mentioned_here/,1743243938.0
What's your thoughts about this?,,https://www.reddit.com/gallery/1jmh5ld,1743233811.0
Does this zinc supplement have enough copper for balance ?,,https://i.redd.it/tsgwfacxukre1.png,1743231729.0
Timing when taking Vitamin K2 MK7 and other tips?,"Hi everyone, I was wondering what's the best time to take K2 MK7? And other general advice or things to be aware of based on your experiences.

I have heard that it is good to take it with a fatty meal since it's fat soluble and absorption would be better. Does it matter if it's morning or evening before sleep? Also my one is 180mcg so I was wondering if I should take it once every 2-3 days as the body can store reserves of it to prevent overdosage. Some sources say 45mcg per day is sufficient.

In addition, I've got some magnesium chelate on hand in case it's needed. 200mg per pill which is about half of daily recommended. As I have heard K2 draws magnesium to efficiently allocate calcium to where it is needed. I get a decent amount of magnesium in diet but not a lot so I got some pills as insurance. I also have the standard 1000UI D3 pills but I do eat a decent amount of wild alaskan canned salmon so that's covered too. Should I take these once every 2 days or a couple times a week? And together with K2 or at other times?

Just as context, the reason why I am taking it is because of Weston Price's work on dental health and his discovery of K2 as the missing ingredient in modern diets. My diet has pretty much everything except K2 which is really hard to get. It includes a balanced amount of meat, fish, fruit, veg and some dairy. No grains or cereals at all, I get complex starchy carbs from sweet potato/potato. I haven't been to a restaurant in 5 years and cook all my meals. I am in my mid-20's and firmly believe that prevention is better than cure, but at the same time don't want to overdo it as I am young and pretty healthy overall. Apologies if too much detail. 

Thanks everyone for your help.",https://www.reddit.com/r/Supplements/comments/1jmgbaa/timing_when_taking_vitamin_k2_mk7_and_other_tips/,1743230053.0
Is this study true  ?,"Im having potassium deficiency and also dealing with cyst acne since last 15 years. Cyst acne and other skin  also has pus in it 
There also one reddit users who said potassium citrate cured his acne , ill post both links in comments ",https://i.redd.it/i9ebg596ikre1.jpeg,1743227440.0
Multivitamin advice,"I'm looking for a multivitamin and I have a few things I'm looking for, and I know I won't find an exact match but that's okay. Comment if you have info that goes against any of these ""wants"" too please!

-Price doesn't matter and pill volume doesn't matter

-I already have EPA/DHA and creatine, don't need any of that

-I'm pretty okay with the low dose of vitamin D they usually include in multis, heading into summer

-I'd prefer a blend of different forms of vitamin E. Maybe A as well.

-I want vitamin K I think? Do I need a blend of different forms for that too?

-I want iodine

-I want choline (which one is the good one again?)

-The more niacin the merrier 

-I don't want too much biotin

-I like the inclusion of boron, lutein/zeaxanthan, or even some lithium

-I don't want iron, chromium, strontium, or vanadium. (Just saw strontium and vanadium in a multivitamin!!)

-I don't really want anything herbal but it's not necessarily a deal breaker 

",https://www.reddit.com/r/Supplements/comments/1jmfdzm/multivitamin_advice/,1743226111.0
Can I stop taking shilajit?,"So I've started taking shilajit recently, the resin form mixing it in milk. I was wondering if I stopped taking shilajit would it undo the effects? Like i take shilajit to boost testosterone would it undo the progress once ive stopped taking it?",https://www.reddit.com/r/Supplements/comments/1jmf307/can_i_stop_taking_shilajit/,1743224898.0
Supplements to help me be a stoner?,"I used to smoke a lot of weed and I really really enjoyed it. Especially out of a vaporizer where I could control the temperature and in effect the cannabinoids that would activate. Really helped me mellow out, focus, and be more creative. Only thing that really ever worked like that. I don't smoke or drink much of anything anymore, but I would like to smoke weed again at some point. But in the past few years every time I'd try, I would get largely paranoid. Like even off small amounts (a 2.5mg edible would feel like nothing but I could hit 3mg and instantly in the overthinkign zone). I'm curious if anyone has any insight as to the pharmacological profile of cannabis, hypothesis for the cause of the anxiogenic properties in some folks, and what compounds/supplements might aid in combatting this. 

>inb4 strains
I don't want to hear it, I used to burn through an ounce a week which certainly isn't crazy but definitely shows you I was smoking heavily. In all my time, while I can attest to some slighttt variations in strains it is all predominantly the same MOA even if the cannbinoid profile is a little different. 

So here goes, retarded question but open to ideas lol",https://www.reddit.com/r/Supplements/comments/1jmdpok/supplements_to_help_me_be_a_stoner/,1743219768.0
Overrated and Underrated Supplements,"Based on your own experiences, can you tell me which supplements are overrated and which supplements are underrated?  
  
\-L-Theaine: Near to zero effect ( I even tried 600mg)  
\-TMG (Betaine) : A lot of energy, mood enchance",https://www.reddit.com/r/Supplements/comments/1jmdlmn/overrated_and_underrated_supplements/,1743219385.0
I created a website to capture ChatGPT supplement summaries based on highly cited literature,"Hi all. I've been trying to play around with making my own website. I settled on trying to automate the process of getting good information on supplements (similar to what you see with examine, but more concise and free!). Its still really early days, but I want to keep improving it with more features and better information. I was thinking of linking the top youtube video and reddit posts covering each supplement as well. Would love to hear your thoughts! I'm still new to all this, but I really want to make it as functional and useful as I can!

[https://supplementviser.com/](https://supplementviser.com/)",https://www.reddit.com/r/Supplements/comments/1jmddln/i_created_a_website_to_capture_chatgpt_supplement/,1743218639.0
Copper deficiency and nerve issues,"# Hi everyone! I have a slight copper deficiency diagnosed by my doctor. For those that developed neuropathy/nerve issues from copper deficiency, would you mind sharing your serum copper/ceruloplasmin levels? And did your symptoms completely resolve with copper supplementation? Thanks!",https://www.reddit.com/r/Supplements/comments/1jmd02r/copper_deficiency_and_nerve_issues/,1743217380.0
What to take in the AM for energy/motivation?,"I completely quit caffeine (even decaf caffeine) and was wondering if anyone could recommend some supplements for energy/motivation.

What I've tried:
Lion's Mane - makes me spaced-out with a weird headache, tried multiple brands
Rhodiola - seems to do nothing sadly
Berberine - actually makes me tired/depressed for some reason (maybe lower blood sugar, but I take it only after meals)

I've also tried the three dopamine supplements (L-Dopa, Tyrosine, Phenylalanine) but they don't seem to work either so I'm not sure what I'm doing wrong.

Anyone have any ideas or suggestions?",https://www.reddit.com/r/Supplements/comments/1jmcqsm/what_to_take_in_the_am_for_energymotivation/,1743216544.0
